Category,Disease / Skin Type,Brand Name,Active Ingredient,Main Indication,Quantity,Stock Status
Endocrinology,Primary Hyperparathyroidism,Sensipar,Cinacalcet HCl,Increases calcium-sensing receptor sensitivity on parathyroid glands,18,In stock
Pulmonology,Acute Bronchial Asthma,Ventolin Evohaler,Salbutamol,Bronchodilator for quick relief of asthma symptoms,3,Low stock
Pulmonology,Asthma & COPD Maintenance,Seretide Diskus,Salmeterol / Fluticasone,Corticosteroid and bronchodilator long-term controller,0,Out of stock
Pulmonology,COPD Chronic Bronchospasm,Spiriva Respimat,Tiotropium Bromide,Long-acting anticholinergic bronchodilator,7,In stock
Pulmonology,Seasonal Allergic Rhinitis,Zyrtec,Cetirizine Hydrochloride,Second-generation antihistamine for allergy symptoms,28,In stock
Pulmonology,Productive Cough / Mucus,Mucosolvan,Ambroxol Hydrochloride,Thins and loosens mucus in respiratory tract,7,In stock
Pulmonology,Dry Irritating Cough,Codilar,Dextromethorphan Hydrobromide,Antitussive agent targeting the cough reflex,31,In stock
Pulmonology,Allergic Asthma Prophylaxis,Singulair,Montelukast Sodium,Leukotriene receptor antagonist for asthma control,12,In stock
Pulmonology,Perennial Allergic Rhinitis,Avamys Nasal Spray,Fluticasone Furoate,Glucocorticoid nasal spray directly mitigating local mucosal inflammation,16,In stock
Rheumatology,Severe Osteoarthritis,Mobic,Meloxicam,Oxicam class NSAID tailored for safe long term joints,8,In stock
Rheumatology,Acute Gout Attack,Colchicine,Colchicine,Reduces inflammation associated with uric acid crystals,38,In stock
Rheumatology,Chronic Hyperuricemia,Zyloric,Allapurinol,Xanthine oxidase inhibitor to lower blood uric acid levels,24,In stock
Rheumatology,Rheumatoid Arthritis DMARD,Methotrexate,Methotrexate Sodium,DMARD to suppress disease progression and joint damage,15,In stock
Rheumatology,Psoriatic Arthritis,Arava,Leflunomide,Pyrimidine synthesis inhibitor downregulating active auto-immune clones,31,In stock
Rheumatology,Systemic Lupus Erythematosus,Plaquenil,Hydroxychloroquine Sulfate,Antimalarial derivative utilized as base auto-immune modulator,2,Low stock
Rheumatology,Ankylosing Spondylitis Flare,Feburic,Febuxostat,Potent non-purine selective inhibitor of xanthine oxidase enzyme,48,In stock
Rheumatology,Chronic Juvenile Arthritis,Humira,Adalimumab,Monoclonal antibody blocking Tumor Necrosis Factor alpha directly,21,In stock
Infectious Disease,Broad Spectrum Bacterial Infection,Augmentin,Amoxicillin / Clavulanic Acid,Amoxicillin protected by clavulanic acid against resistance,38,In stock
Infectious Disease,Atypical Respiratory Infection,Zithromax,Azithromycin,"Macrolide antibiotic for brief, effective compliance",39,In stock
Infectious Disease,Complicated Urinary Tract Infection,Ciprofar,Ciprofloxacin,Fluoroquinolone antibiotic for moderate to severe UTIs,0,Out of stock
Infectious Disease,Anaerobic Infection,Flagyl,Metronidazole,Antiprotozoal and antibacterial agent,36,In stock
Infectious Disease,Systemic Fungal Infection,Flucoral,Fluconazole,Systemic antifungal treatment for yeast and fungal infections,40,In stock
Infectious Disease,Lower Respiratory Tract Infection,Tavanic,Levofloxacin,Advanced fluoroquinolone covering atypical pathogens and severe pneumonia,35,In stock
Infectious Disease,Skin & Soft Tissue Infection,Dalacin C,Clindamycin Hydrochloride,Lincosamide antibiotic targeting gram-positive anaerobic clusters,33,In stock
Infectious Disease,Intestinal Parasites,Secnidal,Secnidazole,Single dose antiprotozoal eradication therapy for tissue parasites,24,In stock
Ophthalmology,Bacterial Conjunctivitis,Tobrex,Tobramycin,Topical ophthalmic antibiotic drops,50,In stock
Ophthalmology,Ocular Allergy & Redness,Efemoline,Fluorometholone,Corticosteroid eye drops for ocular inflammation,33,In stock
Ophthalmology,Severe Dry Eye Syndrome,Tears Naturale II,Dextran / Hypromellose,Lubricating artificial tears for dry eye relief,1,Low stock
Ophthalmology,Open-Angle Glaucoma,Xalatan,Latanoprost,Prostaglandin analog to lower intraocular pressure,48,In stock
Urology,Benign Prostatic Hyperplasia (BPH),Tamsulin,Tamsulosin Hydrochloride,Alpha-1 blocker to improve urinary flow in BPH,13,In stock
Urology,Erectile Dysfunction,Viagra,Sildenafil Citrate,PDE5 inhibitor to improve erectile response,17,In stock
Urology,Overactive Bladder,Ur暢an,Solifenacin Succinate,Anticholinergic to reduce urinary frequency and urgency,30,In stock
Urology,BPH Gland Size Reduction,Avodart,Dutasteride,Blocks Type II 5-alpha reductase to decrease prostate size,32,In stock
