Category,Disease / Skin Type,Brand Name,Active Ingredient,Main Indication,Quantity,Stock Status
Gastroenterology,GERD / Acid Reflux,Nexium,Esomeprazole,"Reduces stomach acid, treats acid reflux and GERD",8,In stock
Gastroenterology,Peptic Ulcer Disease,Antodine,Famotidine,H2 receptor antagonist used to treat ulcers and heartburn,29,In stock
Gastroenterology,Irritable Bowel Syndrome (IBS),Colofac,Mebeverine,Antispasmodic to relieve abdominal pain and cramps in IBS,15,In stock
Gastroenterology,Nausea & Vomiting,Motilium,Domperidone,Antiemetic and prokinetic for nausea and gastric emptying,47,In stock
Gastroenterology,Acute Diarrhea,Streptoquin,Diiodohydroxyquinoline / Phthalylsulfathiazole,Anti-diarrheal and intestinal antiseptic,46,In stock
Gastroenterology,Chronic Constipation,Duphalac,Lactulose,Osmotic laxative for chronic constipation,35,In stock
Gastroenterology,Bloating & Flatulence,Disflatyl,Simethicone,"Alleviates gas, bloating, and abdominal discomfort",6,In stock
Gastroenterology,Ulcerative Colitis,Pentasa,Mesalazine,Anti-inflammatory for Ulcerative Colitis and Crohn's disease,29,In stock
Gastroenterology,Fatty Liver Disease,Legalon,Silymarin,Hepatoprotective agent supporting liver function,36,In stock
Gastroenterology,Abdominal Spasms,Buscopan,Hyoscine Butylbromide,Relieves painful spasms in the stomach and digestive tract,36,In stock
Gastroenterology,Gastroesophageal Reflux,Gaviscon Double Action,Sodium Alginate / Calcium Carbonate,Creates a protective raft over stomach contents to prevent reflux,37,In stock
Gastroenterology,Gastric Hyperacidity,Ganaton,Itopride Hydrochloride,Prokinetic agent to improve gastrointestinal motility,47,In stock
Gastroenterology,Gastroparesis,Kreon,Pancreatin,"Digestive enzyme supplement for fat, protein, and starch",1,Low stock
Gastroenterology,Exocrine Pancreatic Insufficiency,Peptic Care,Omeprazole / Amoxicillin / Clarithromycin,Combination pack for treating Helicobacter pylori infection,25,In stock
Gastroenterology,H. Pylori Infection,Antinal,Nifuroxazide,Broad-spectrum intestinal antiseptic for diarrhea,5,Low stock
Gastroenterology,Traveler's Diarrhea,Imodium,Loperamide Hydrochloride,Antidiarrheal agent that slows intestinal motility,35,In stock
Gastroenterology,Antibiotic-Associated Diarrhea,Sedalac,Lactulose Liquid,Reduces blood ammonia levels in chronic liver patients,0,Out of stock
Gastroenterology,Portal Hypertension,Duspatalin Retard,Mebeverine Hydrochloride,Sustained-release capsule for continuous bowel symptom relief,20,In stock
Gastroenterology,Biliary Colic,Zofran,Ondansetron,Serotonin 5-HT3 receptor antagonist for severe emesis,32,In stock
Gastroenterology,Hyperammonemia,Controloc,Pantoprazole,Proton pump inhibitor used for long term erosive esophagitis,50,In stock
Gastroenterology,Chronic Gastritis,Gastrozole,Omeprazole,Inhibits proton pump mechanism to keep stomach pH elevated,48,In stock
Gastroenterology,Erosive Esophagitis,Itopride,Itopride Hydrochloride,Prokinetic resolving postprandial fullness and early satiety,15,In stock
Gastroenterology,Functional Dyspepsia,DigestEze,Digestive Enzymes Complex,Multi-enzyme formulation assisting complex nutrient breakdown tasks,8,In stock
Gastroenterology,Spasmodic Colitis,Gastrobiotic,Rifaximin,Non-absorbable antibiotic acting purely within intestinal lumen,15,In stock
Gastroenterology,Motion Sickness,Lacteol Fort,Lactobacillus acidophilus,Probiotic culture restoring disrupted physiological microflora balance,17,In stock
Gastroenterology,NSAID-Induced Ulcers,Constulose,Lactulose,Liquid laxative modifying stool consistency via osmotic pressure,2,Low stock
Gastroenterology,Zollinger-Ellison Syndrome,Prasocil,Propranolol,Non-selective beta blocker lowering venous pressure in varices,5,Low stock
Gastroenterology,Duodenal Ulcer,Spasmomen,Otilonium Bromide,Quaternary ammonium compound acting on local intestinal smooth muscle,48,In stock
Gastroenterology,Intestinal Amebiasis,Vomidoxine,Meclizine HCl / Pyridoxine HCl,Safe combination antihistamine and vitamin B6 for morning sickness,38,In stock
Gastroenterology,Chronic Diarrhea,Emanera,Esomeprazole Magnesium,Suppresses baseline nocturnal acid outputs for mucosal healing,16,In stock
Gastroenterology,Gas & Indigestion,Pariet,Rabeprazole Sodium,Suppresses baseline acid production rapidly and continuously,41,In stock
Gastroenterology,Idiopathic Constipation,Mucofalk,Psyllium Husk,Natural fiber supplement to induce healthy intestinal peristalsis,33,In stock
Gastroenterology,Non-Ulcer Dyspepsia,Spasmo-Am darkness,Metoclopramide / Dimethicone,Combines anti-gas actions with powerful upper GI motility enhancement,49,In stock
Gastroenterology,Hepatic Encephalopathy,Uralyt-U,Potassium Citrate,Alkalinizes urine to prevent and dissolve uric acid stones,0,Out of stock
Gastroenterology,Cyclic Vomiting Syndrome,St決or,Metoclopramide,Directly stops vomiting signaling centers in the central nervous system,44,In stock
Gastroenterology,Acid Indigestion,Normix,Rifaximin Granules,Targets local bowel lumen pathogens without causing systemic toxicity,12,In stock
Gastroenterology,Gastrointestinal Hypermotility,Spasmo-Canulase,Cellulase / Amylase / Lipase,Relieves heavy gaseous pressure and dynamic abdominal distension,48,In stock
Gastroenterology,Post-operative Ileus,Librax,Chlordiazepoxide / Clidinium Bromide,Classic antianxiety and antispasmodic blend for psychosomatic colitis,19,In stock
Gastroenterology,Pancreatitis Symptoms,Deflat,Simethicone Drops,Fast relief for infant colic and structural air bubbles,4,Low stock
Gastroenterology,Aphthous Stomatitis,Gastro-Diet,Herbal Carminative Extract,Supports proper lipid metabolism across active liver cells,42,In stock
Cardiology,Essential Hypertension,Concor,Bisoprolol Fumarate,Beta-blocker to lower blood pressure and manage heart rate,26,In stock
Cardiology,Congestive Heart Failure,Capoten,Captopril,ACE inhibitor for blood pressure control and post-MI recovery,7,In stock
Cardiology,Angina Pectoris,Exforge,Amlodipine / Valsartan,Combination medication for effective blood pressure management,30,In stock
Cardiology,Atrial Fibrillation,Cordarone,Amiodarone Hydrochloride,Antiarrhythmic agent to maintain normal heart rhythm,22,In stock
Cardiology,Acute Myocardial Infarction,Nitromint,Nitroglycerin,Vasodilator for acute relief of angina symptoms,32,In stock
Cardiology,Hypercholesterolemia,Lasix,Furosemide,Loop diuretic to remove excess fluid from the body,12,In stock
Cardiology,Deep Vein Thrombosis (DVT),Plavix,Clopidogrel,Antiplatelet agent to prevent blood clots,6,In stock
Cardiology,Pulmonary Embolism,Marevan,Warfarin,Anticoagulant for deep vein thrombosis and atrial fibrillation,17,In stock
Cardiology,Hypertriglyceridemia,Lipitor,Atorvastatin,Statin to lower bad cholesterol (LDL) and triglycerides,13,In stock
Cardiology,Bradycardia,Crestor,Rosuvastatin,HMG-CoA reductase inhibitor for cardiovascular risk reduction,29,In stock
Cardiology,Paroxysmal Tachycardia,Lanoxin,Digoxin,Cardiac glycoside that increases myocardial contractility force,0,Out of stock
Cardiology,Chronic Stable Angina,Cozaar,Losartan Potassium,Angiotensin II receptor blocker managing BP and renal safety,1,Low stock
Cardiology,Diabetic Nephropathy / Hypertension,Zestril,Lisinopril,ACE inhibitor for stable hypertension management,45,In stock
Cardiology,Refractory Hypertension,Natrilix SR,Indapamide SR,Thiazide-like diuretic formulated for sustained BP lowering,31,In stock
Cardiology,Hypertensive Emergency,Vastarel MR,Trimetazidine dihydrochloride,Anti-ischemic metabolic agent for stable angina pectoris,33,In stock
Cardiology,Ventricular Arrhythmia,Clexane,Enoxaparin Sodium,Low molecular weight heparin for acute thromboembolism,5,Low stock
Cardiology,Aortic Dissection BP Control,Xarelto,Rivaroxaban,Direct oral anticoagulant (DOAC) blocking Factor Xa,7,In stock
Cardiology,Post-MI Cardioprotection,Lipanthyl,Fenofibrate,Fibric acid derivative targeting plasma lipid profiles,8,In stock
Cardiology,Raynaud's Phenomenon,Revatio,Sildenafil,Vasodilator specific to pulmonary arterial bed,36,In stock
Cardiology,Pulmonary Arterial Hypertension,Tridil,Nitroglycerin IV,Intravenous vasodilator for immediate pressure reduction,31,In stock
Cardiology,Mild Hypertension,Aspirin Protect,Acetylsalicylic Acid,Low-dose enteric coated aspirin inhibiting platelet thromboxane A2,7,In stock
Cardiology,Isolated Systolic Hypertension,Isoptin,Verapamil Hydrochloride,Calcium channel blocker slowing AV node conduction velocities,7,In stock
Cardiology,Unstable Angina,Minoxidil,Minoxidil,Direct acting smooth muscle vasodilator for resistant pressure cases,39,In stock
Cardiology,Coronary Artery Disease,Heparin Injection,Heparin Sodium,Systemic immediate anticoagulant for acute vascular block scenarios,7,In stock
Cardiology,Cardiac Edema,Coumadin,Warfarin Sodium,Vitamin K antagonist requiring precise INR monitoring schedules,2,Low stock
Cardiology,Cerebrovascular Stroke Prevention,Zetia,Ezetimibe,Cholesterol absorption inhibitor working at small intestine border,26,In stock
Cardiology,Peripheral Arterial Disease,Dopamine Injection,Dopamine Hydrochloride,Inotropic catecholamine support elevating peripheral vascular pressure fields,22,In stock
Cardiology,Valvular Heart Disease Anticoagulation,Cardura,Doxazosin Mesylate,Alpha-1 adrenergic blocker reducing systemic vascular resistance pathways,0,Out of stock
Cardiology,Atherosclerosis Prophylaxis,Moduretic,Amiloride / Hydrochlorothiazide,Potassium-sparing and thiazide diuretic preventing potassium depletion fields,48,In stock
Cardiology,Hyperlipidemia,Tenormin,Atenolol,Reduces heart load by selectively blocking peripheral beta-1 receptors,15,In stock
Cardiology,Orthostatic Hypotension,Norvasc,Amlodipine Besylate,Inhibits peripheral calcium influx to safely dilate narrow arterial walls,12,In stock
Cardiology,Sinus Tachycardia,Aldactone,Spironolactone,Aldosterone antagonist managing fluid retention and modern heart failure,20,In stock
Cardiology,Supraventricular Tachycardia,Atacand,Candesartan Cilexetil,Angiotensin receptor antagonist offering advanced vascular protection profiles,44,In stock
Cardiology,Variant Angina (Prinzmetal),Diovan,Valsartan,Blocks key physiological vasoconstriction pathways to maintain balanced pressure,32,In stock
Cardiology,Renal Hypertension,Adalat Retard,Nifedipine,Sustained-release organic calcium channel blocker controlling daily chest tightness,21,In stock
Cardiology,Idiopathetic Cardiomyopathy,Micardis,Telmisartan,Provides dynamic 24-hour baseline pressure reduction for diabetic individuals,39,In stock
Cardiology,Chronic Heart Failure Management,Blopress,Candesartan,Blocks specific angiotensin pathways to prevent post-ischemic arterial stretching,40,In stock
Cardiology,Fluid Overload in Heart Failure,Nebilet,Nebivolol,Highly selective beta-blocker with additional safe nitric oxide vasodilating actions,2,Low stock
Cardiology,Ischemic Heart Disease,Dyazide,Hydrochlorothiazide / Triamterene,Reduces blood pressure while safely preserving potassium minerals,38,In stock
Cardiology,Left Ventricular Dysfunction,Inspra,Eplerenone,Protects vital cardiac muscle fields from chronic remodeling and strain,8,In stock
Neurology / Pain Management,Acute Migraine Attack,Zomig,Zolmitriptan,Triptan for targeted relief of acute migraine attacks,14,In stock
Neurology / Pain Management,Tension Headache,Excedrin,Acetaminophen / Aspirin / Caffeine,Combination pain reliever for severe headaches,9,In stock
Neurology / Pain Management,Chronic Migraine Prophylaxis,Panadol Advance,Paracetamol,Analgesic and antipyretic for everyday pain relief,35,In stock
Neurology / Pain Management,Neuropathic Pain (Diabetic),Inderal,Propranolol Hydrochloride,Beta-blocker used to reduce the frequency of migraines,20,In stock
Neurology / Pain Management,Trigeminal Neuralgia,Lyrica,Pregabalin,"Treats nerve pain from diabetes, shingles, or spinal injury",0,Out of stock
Neurology / Pain Management,Acute Muscle Spasms,Myolgin,Paracetamol / Chlorzoxazone,Muscle relaxant and analgesic combination,40,In stock
Neurology / Pain Management,Osteoarthritis Pain,Voltaren,Diclofenac Sodium,NSAID for severe joint pain and inflammatory conditions,27,In stock
Neurology / Pain Management,Rheumatoid Arthritis Flare,Cataflam,Diclofenac Potassium,Fast-acting NSAID for menstrual cramps and acute pain,40,In stock
Neurology / Pain Management,Ankylosing Spondylitis,Tramal,Tramadol Hydrochloride,Opioid analgesic for moderate to severe pain,11,In stock
Neurology / Pain Management,Severe Acute Pain,Amigraine ADCO,Analgin / Caffeine / Ergotamine,Specific combination for treating migraine attacks,41,In stock
Neurology / Pain Management,Cluster Headache,Topamax,Topiramate,Anticonvulsant effective in limiting vascular headache onset,2,Low stock
Neurology / Pain Management,Post-Herpetic Neuralgia,Imitrex,Sumatriptan Succinate,Classic triptan formulation for immediate cranial vasoconstriction,7,In stock
Neurology / Pain Management,Fibromyalgia,Neurontin,Gabapentin,Gaba analogue specifically mitigating sharp nerve pain pathways,18,In stock
Neurology / Pain Management,Sciatica & Lower Back Pain,Paramol,Paracetamol Pure,Gentle systemic analgesic suitable for delicate stomach lining,19,In stock
Neurology / Pain Management,Dental Pain / Toothache,Brufen,Ibuprofen,Widely relied upon NSAID reducing localized joint swelling,22,In stock
Neurology / Pain Management,Menstrual Cramps (Dysmenorrhea),Ketofan,Ketoprofen,Potent non-steroidal anti-inflammatory for intense pain cycles,49,In stock
Neurology / Pain Management,Post-operative Pain,Oflam,Diclofenac Potassium Salt,Rapid-release potassium salt formula targeting oral inflammation,33,In stock
Neurology / Pain Management,Mild Fever & General Body Aches,Arcoxia,Etoricoxib,Highly selective COX-2 inhibitor for chronic spine arthropathy,36,In stock
Neurology / Pain Management,Chronic Pain Syndrome,Dimra,Diclofenac Potassium / Methocarbamol,Double action skeletal muscle relaxant paired with NSAID,19,In stock
Neurology / Pain Management,Cervical Spondylosis Pain,Adco-Dol,Paracetamol / Codeine / Caffeine,Narcotic-analgesic compound for resistant tension headache states,20,In stock
Neurology / Pain Management,Vascular Headache,Sibelium,Flunarizine Dihydrochloride,Calcium antagonist preventing cortical spreading depression cycles,18,In stock
Neurology / Pain Management,Neurological Muscle Rigidity,Naramig,Naratriptan Hydrochloride,Triptan variant with longer duration for sustained headache control,0,Out of stock
Neurology / Pain Management,Post-Traumatic Inflammation & Edema,Tegretol,Carbamazepine,Antiepileptic stabilizing hyper-excited neural cell membranes,18,In stock
Neurology / Pain Management,Cancer Pain Management,Abimol,Paracetamol Systemic,Pure antipyretic pain relief option clean from stomach toxicity,1,Low stock
Neurology / Pain Management,Peripheral Neuropathy,Alphantern,Chymotrypsin / Trypsin,Anti-inflammatory enzyme formula reducing localized tissue edema,21,In stock
Neurology / Pain Management,Juvenile Rheumatoid Arthritis,Feldene,Piroxicam,Long half-life NSAID useful for structural joint issues,14,In stock
Neurology / Pain Management,Acute Gouty Arthritis,Catafast,Diclofenac Potassium Sachet,Soluble rapid action analgesic powder for prompt systemic absorption,9,In stock
Neurology / Pain Management,Bursitis & Tendinitis,Xefo,Lornoxicam,Oxicam class analgesic with high analgesic power for nerve compressions,35,In stock
Neurology / Pain Management,Musculoskeletal Sprains,Baclofen,Baclofen,GABA-B agonist acting on spinal cord to minimize rigidity,30,In stock
Neurology / Pain Management,Central Pain Syndrome,Paramax,Paracetamol / Metoclopramide,Simultaneous pain relief and prokinetic to stop migraine emesis,13,In stock
Neurology / Pain Management,Primary Dysmenorrhea,Relpax,Eletriptan Hydrobromide,Highly selective triptan providing fast relief from pulsating cranial pain,28,In stock
Neurology / Pain Management,Spasticity from Spinal Injury,Maxalt,Rizatriptan Benzoate,Rapid-disintegrating triptan formulation bypassing heavy nausea blocks,40,In stock
Neurology / Pain Management,Migraine-Associated Nausea,Gabamed,Gabapentin Monohydrate,Modulates neurological calcium channels to limit hyper-active peripheral nerve signals,23,In stock
Neurology / Pain Management,Occipital Neuralgia,Protelos,Strontium Ranelate,Stimulates bone matrix preservation pathways in severe chronic skeletal pain,39,In stock
Neurology / Pain Management,Radiculopathy Pain,Celebrex,Celecoxib,Targeted joint pain inhibitor preserving protective stomach mucosal fields,10,In stock
Neurology / Pain Management,Arthritic Joint Swelling,Xefo Rapid,Lornoxicam Rapid,Advanced oxicam derivative providing rapid targeted skeletal pain reduction,9,In stock
Neurology / Pain Management,Soft Tissue Injury Pain,Diclac,Diclofenac Sodium SR,High-dose delayed release NSAID tackling continuous morning joint rigidity,2,Low stock
Neurology / Pain Management,Nocturnal Leg Cramps,Prontogest Pain,Progesterone Derivative,Injectable hormone support managing extreme structural gynecological pain cycles,16,In stock
Neurology / Pain Management,Paroxysmal Pain Episodes,Fastum Gel,Ketoprofen Gel,Topical fast-absorbing NSAID gel bypassing systemic digestive tracts,0,Out of stock
Neurology / Pain Management,Mild Arthralgia,Mobitil,Tenoxicam,Potent non-steroidal anti-inflammatory targeting multi-joint arthritic swelling,5,Low stock
Dermatology (Skin Cleansers),Oily & Acne-Prone Skin,La Roche-Posay Effaclar Gel,Zinc Pidolate / Caprylyl Glycol,Purifying foaming gel cleanser that reduces excess sebum,49,In stock
Dermatology (Skin Cleansers),Acne-Prone / Clogged Pores,Bioderma Sebium Gel Moussant,Zinc Sulfate / Copper Sulfate,Gently cleanses and limits sebum secretion,37,In stock
Dermatology (Skin Cleansers),Dry to Very Dry Skin,CeraVe Hydrating Cleanser,Ceramides / Hyaluronic Acid,Cleanses and hydrates without disrupting the skin barrier,15,In stock
Dermatology (Skin Cleansers),Highly Sensitive Skin,Cetaphil Gentle Skin Cleanser,Glycerin / Vitamin B5,"Soap-free, non-irritating formula for sensitive skin",14,In stock
Dermatology (Skin Cleansers),Hyperpigmentation / Dull Skin,Bioderma Pigmentbio Foaming Cream,AHA / Exfoliating Beads,Brightening cleanser that helps reduce dark spots,16,In stock
Dermatology (Skin Cleansers),Combination Skin (T-Zone),Vichy Normaderm Phytosolution,Salicylic Acid / Copper / Zinc,Deep cleansing gel targeting blemishes and oily zones,24,In stock
Dermatology (Skin Cleansers),"Dry, Acne-Prone Skin",Avene Cleanance Hydra,Dextran Sulfate / Thermal Spring Water,Soothing cleansing cream for skin dried by acne treatments,23,In stock
Dermatology (Skin Cleansers),Acne-Prone Skin / Exfoliation,SVR Sebiaclear Gel Moussant,Gluconolactone / Salicylic Acid,Soap-free purifying and exfoliating gel for acne-prone skin,23,In stock
Dermatology (Skin Cleansers),Anti-Aging / Fine Lines,Eucerin DermatoClean,Hyaluronic Acid / APG Complex,Mild but effective cleansing complex that helps skin breathe,50,In stock
Dermatology (Skin Cleansers),Severe Oily Skin & Imperfections,Uriage Hyseac Cleansing Gel,Piroctone Olamine / Epilobium,Eliminates impurities and excess sebum while respecting epidermis,1,Low stock
Dermatology (Skin Cleansers),Acne-Prone / Inflamed Skin,La Roche-Posay Effaclar Micro-Peeling,Salicylic Acid / LHA,Intense deep cleanser clearing severe imperfections and sebum,48,In stock
Dermatology (Skin Cleansers),Open & Closed Blackheads,Cetaphil Oily Skin Cleanser,Glycerin / Panthenol Formula,Foaming wash removing 99% of excess oil without over-drying,48,In stock
Dermatology (Skin Cleansers),Atopic Dermatitis / Eczema-Prone,Bioderma Atoderm Intensive Gel Moussant,Zinc / Copper Sulfate / Vitamin PP,Soothes itching and restores natural lipid protective barrier,20,In stock
Dermatology (Skin Cleansers),Psoriasis-Prone / Flaky Skin,CeraVe SA Smoothing Cleanser,Salicylic Acid / Urea,Exfoliates rough skin textures gently while maintaining hydration,28,In stock
Dermatology (Skin Cleansers),Melasma & Dark Spots,IsisPharma Neotone Gel,Azelaic Acid / Glycolic Acid,Exfoliates melanin spots and unifies immediate facial tone,11,In stock
Dermatology (Skin Cleansers),Adult Blemish-Prone Skin,Eucerin ProAcne Solution Cleansing Gel,Amphoteric Surfactants,"Soap-free, fragrance-free daily wash for blemish-prone skin",0,Out of stock
Dermatology (Skin Cleansers),Rosacea / Redness-Prone,Avene Antirougeurs Clean,TRP-Regulin / Thermal Spring Water,Refreshing dermo-cleansing milk targeting redness and flushing,18,In stock
Dermatology (Skin Cleansers),Hormonal Cystic Acne,SVR Sebiaclear Cicapeel,Gluconolactone Complex,Active gel cleanser reducing bacterial growth and marks,43,In stock
Dermatology (Skin Cleansers),Dehydrated Oily Skin,Vichy Purete Thermale Fresh Gel,Amilite Technology / Moringa,Cleanses pollution particles and hard water residue effects,44,In stock
Dermatology (Skin Cleansers),Post-Procedure / Damaged Skin,Uriage Hyseac Clean-Up Cream,Piroctone Olamine / Cerasterol-2F,Cleanses gently while compensating for drying dermatological drugs,28,In stock
Dermatology (Skin Cleansers),"Sensitive, Redness-Prone Skin",La Roche-Posay Effaclar H Iso-Biome,Vitamin B5 / Aqua Posae Filiformis,Soothing wash restoring comfort to skin thinned by Isotretinoin,37,In stock
Dermatology (Skin Cleansers),Oily Skin / Uneven Texture,Bioderma Sebium Gel Gommant,Salicylic Acid / Gentle Micro-beads,Mechanical and chemical exfoliating wash deep cleaning facial pores,12,In stock
Dermatology (Skin Cleansers),Severely Dehydrated Skin,Lipikar Syndet AP+,Shea Butter / Niacinamide,Ultra-gentle cleansing cream base minimizing skin scratching impulses,3,Low stock
Dermatology (Skin Cleansers),Acne-Scarred Skin / Dullness,CeraVe Psoriasis Cleanser,Salicylic Acid / Ceramides Base,Exfoliates scaling skin plaques while protecting underlying lipids,23,In stock
Dermatology (Skin Cleansers),Sensitive Skin / Makeup Removal,Melascreen Cleansing Gel,Azelaic Acid Derivative,Inhibits tyrosinase pathways while washing away surface dead cells,15,In stock
Dermatology (Skin Cleansers),Flaky Skin / Severe Dryness,Normaderm Phytosolution Mattifying,Volcanic Perlite / Active Clay,Clay-to-foam deep cleanser absorbing oily shine long term,27,In stock
Dermatology (Skin Cleansers),Hyperpigmented Skin / Dark Patches,Bioderma Sensibio DS+ Gel,Rosactiv Patent / Piromycine,Sanitizing cleansing gel fighting redness causes and scaling flares,13,In stock
Dermatology (Skin Cleansers),Combination / Dull Skin,SVR Sebiaclear Active Gel,Niacinamide / Gluconolactone Active,Highly concentrated skin wash minimizing red papules and scars,17,In stock
Dermatology (Skin Cleansers),Acne-Prone / Sensitive Skin,Vichy Mineral Micellar Water,Mineralizing Water / Panthenol,Magnet-like micelle formula removing dirt without disturbing lipids,33,In stock
Dermatology (Skin Cleansers),Oily Skin / Enlarged Pores,Uriage Bariederm Cica-Gel,Copper-Zinc / TLR2-Regul,Purifying copper gel preventing bacterial growth on healing skin,40,In stock
Dermatology (Skin Cleansers),"Irritated, Broken Skin Barrier",Avene Extremely Gentle Cleanser,Avène Thermal Spring Water / Gentle Surfactant,No-rinse ultra-mild fluid formula protecting reactive epidermis,22,In stock
Dermatology (Skin Cleansers),Sun-Damaged Skin,Cetaphil Bright Healthy Radiance,Glycerin / Niacinamide B3,Gently cleanses while initializing skin color correction and radiance,47,In stock
Dermatology (Skin Cleansers),Atopic Skin in Infants & Adults,Laroche-Posay Lipikar AP+ Oil,Shea Butter / Cleansing Lipids,Replenishes skin lipids during showering to stop severe itching triggers,0,Out of stock
Dermatology (Skin Cleansers),"Oily, Sensitive Skin",Ducray Keracnyl Foaming Gel,Myrtacine / Sabal Serrulata,Targeted wash that breaks down tough blackheads and acne crusts,39,In stock
Dermatology (Skin Cleansers),Dry Skin with Redness,IsisPharma Teen Derm Gel,Salicylic Acid / Glycolic Acid,Deeply purifies pores using intensive keratolytic active combinations,29,In stock
Dermatology (Skin Cleansers),Hyperpigmentation Prevention,Neutrogena Hydro Boost Water Gel Cleanser,Hyaluronic Acid / Gentle Surfactants,Deeply hydrates while washing away daily environmental impurities,2,Low stock
Dermatology (Skin Cleansers),Acne-Prone with Blackheads,Eucerin Even Radiance Cleansing Foam,Vitamin C / Niacinamide / Brightening Complex,Luxurious foam delivering instant brightening actives to dull faces,29,In stock
Dermatology (Skin Cleansers),Dry and Itchy Skin,CeraVe Foaming Facial Cleanser,Ceramides / Niacinamide / Hyaluronic Acid,Foaming cleanser that completely balances mixed skin zones flawlessly,19,In stock
Dermatology (Skin Cleansers),Combination / Sensitive Skin,Bioderma Sensibio H2O Micellar,Micelles / Cucumber Extract,Classic dermatological micellar water preserving natural physiological pH,17,In stock
Dermatology (Skin Cleansers),Exfoliation for Dull Skin,Avene Cleanance Cleansing Gel,Monolaurin / Zinc Salicylate,Gently purifies oily skin surfaces while preventing heavy rebound sebum,20,In stock
Endocrinology,Type 2 Diabetes Mellitus,Glucophage,Metformin Hydrochloride,Improves insulin sensitivity and lowers blood glucose,39,In stock
Endocrinology,Type 2 Diabetes (Combination),Janumet,Sitagliptin / Metformin,Inhibits DPP-4 enzyme and limits hepatic glucose synthesis,33,In stock
Endocrinology,Hypothyroidism,Euthyrox,Levothyroxine Sodium,Synthetic thyroid hormone replacement therapy,14,In stock
Endocrinology,Hyperthyroidism,Carbimazole,Carbimazole,Antithyroid agent that reduces thyroid hormone production,12,In stock
Endocrinology,Postmenopausal Osteoporosis,Fosamax,Alendronate Sodium,Bisphosphonate to prevent and treat bone loss,33,In stock
Endocrinology,Hyperprolactinemia,Dostinex,Cabergoline,Dopamine agonist to reduce excess prolactin levels,39,In stock
Endocrinology,Severe Vitamin D Deficiency,Devarol-S,Cholecalciferol (Vitamin D3),High-dose vitamin D injection/oral drop for bone health,9,In stock
